{
  "$schema": "http://json-schema.org/draft-04/schema#",
  "title": "Events collector configuration schema.",
  "type": "object",
  "properties": {
    "id": {
      "type": "string",
      "description": "Event collector id.",
      "default": "Auto-generated id."
    },
    "persistExecutionLog": {
      "type": "boolean",
      "description": "Whether it has to persist to disk log execution or not.",
      "default": "false"
    },
    "multiThreadingEnabled": {
      "type": "boolean",
      "description": "Whether it has to enable multi-threading. That means: for each input a new thread will be created.",
      "default": "false"
    },
    "metadata": {
      "type": "object",
      "description": "A key-value hash <string, string> in order to exchange metadata between configurations (main, inputs and outputs)."
    },
    "scheduler": {
      "$ref": "eventCollectionSchedule"
    },
    "reporters": {
      "type": "array",
      "items": {
        "type": { "$ref": "reporter" }
      }
    },
    "cleaners": {
      "type": "array",
      "items": {
        "type": { "$ref": "cleaner" }
      }
    },
    "eventsCollectorListeners": {
      "type": "array",
      "items": {
        "type": "string"
      }
    },
    "inputs": {
      "type": "array",
      "items": {
        "type": { "$ref": "input" }
      }
    },
    "outputs": {
      "type": "array",
      "items": {
        "type": { "$ref": "output" }
      }
    }
  }
}